{
  "level": 9,
  "board_size": 5,
  "grid": [
    [
      "EMPTY",
      "EMPTY",
      "NODE_A1",
      "NODE_D1",
      "EMPTY"
    ],
    [
      "EMPTY",
      "BLOCKED",
      "NODE_D2",
      "EMPTY",
      "NODE_B1"
    ],
    [
      "BLOCKED",
      "EMPTY",
      "EMPTY",
      "NODE_C1",
      "EMPTY"
    ],
    [
      "NODE_B2",
      "EMPTY",
      "EMPTY",
      "NODE_A2",
      "EMPTY"
    ],
    [
      "BLOCKED",
      "EMPTY",
      "EMPTY",
      "NODE_C2",
      "EMPTY"
    ]
  ],
  "pairs": [
    {
      "id": "A",
      "start": [
        0,
        2
      ],
      "end": [
        3,
        3
      ],
      "color": "#0EA5E9"
    },
    {
      "id": "B",
      "start": [
        1,
        4
      ],
      "end": [
        3,
        0
      ],
      "color": "#0284C7"
    },
    {
      "id": "C",
      "start": [
        2,
        3
      ],
      "end": [
        4,
        3
      ],
      "color": "#0891B2"
    },
    {
      "id": "D",
      "start": [
        0,
        3
      ],
      "end": [
        1,
        2
      ],
      "color": "#0369A1"
    }
  ],
  "blockers": [
    [
      4,
      0
    ],
    [
      2,
      0
    ],
    [
      1,
      1
    ]
  ],
  "solution_count": 1,
  "target_density": "SINGLE",
  "golden_path": {
    "A": [
      [
        0,
        2
      ],
      [
        1,
        2
      ],
      [
        2,
        2
      ],
      [
        3,
        2
      ],
      [
        3,
        3
      ]
    ],
    "B": [
      [
        1,
        4
      ],
      [
        2,
        4
      ],
      [
        3,
        4
      ],
      [
        3,
        3
      ],
      [
        3,
        2
      ],
      [
        3,
        1
      ],
      [
        3,
        0
      ]
    ],
    "C": [
      [
        2,
        3
      ],
      [
        3,
        3
      ],
      [
        4,
        3
      ]
    ],
    "D": [
      [
        0,
        3
      ],
      [
        1,
        3
      ],
      [
        1,
        2
      ]
    ]
  },
  "validation": {
    "solvable": true,
    "density_match": true,
    "early_mistake_detection": true,
    "no_isolated_pairs": true,
    "no_late_dead_ends": true,
    "curve_integrity": true
  },
  "meta": {
    "generation_attempts": 8,
    "failed_checks": []
  }
}
